{
  "schemaVersion": 1,
  "defaultLocale": "it",
  "sourceLocale": "it",
  "supportedLocales": [
    "it"
  ],
  "defaultVoiceId": "vijay",
  "credits": {
    "authors": [
      {
        "name": "Marco Buttu",
        "url": "https://www.instagram.com/marco.buttu/"
      },
      {
        "name": "Arianna Macciantelli",
        "url": "https://www.instagram.com/a.riamm/"
      }
    ],
    "voiceHonorific": "Guruji",
    "voiceName": "Vijay Kumar",
    "voiceUrl": "https://www.ashtangasaadhana.com/"
  },
  "features": {
    "study": true,
    "continuousRecitation": true,
    "explanations": true,
    "tests": true
  }
}
